{
  "$schema": "https://json-schema.org/draft/2020-12/schema",
  "$id": "vss.context_assembly_report/1",
  "type": "object", "additionalProperties": false,
  "required": ["schema_version", "report_id", "report_contract_identity", "report_contract_version", "context_id", "request_id", "correlation_id", "semantic_task", "semantic_task_version", "context_family", "context_family_version", "policy_identity", "policy_version", "package_references", "included_item_references", "omitted_item_references", "rejected_item_references", "classification", "trust_result", "freshness_result", "revocation_result", "conflict_count", "uncertainty_count", "limitations_count", "package_set_digest", "selection_digest", "context_content_digest", "budget_limits", "budget_consumption", "constructed_at", "expires_at", "lifecycle", "status", "warnings", "limitations", "integrity"],
  "properties": {
    "schema_version": {"const": "1"}, "report_id": {"type": "string", "maxLength": 128}, "report_contract_identity": {"const": "context_assembly_report"}, "report_contract_version": {"const": "1"}, "context_id": {"type": "string", "maxLength": 128}, "request_id": {"type": "string", "maxLength": 128}, "correlation_id": {"type": "string", "maxLength": 128}, "semantic_task": {"const": "generate_options"}, "semantic_task_version": {"const": "1"}, "context_family": {"const": "generate_options_context"}, "context_family_version": {"const": "1"}, "policy_identity": {"const": "generate_options_context_local"}, "policy_version": {"const": "1"}, "package_references": {"type": "array", "maxItems": 4, "items": {"type": "string", "maxLength": 128}}, "included_item_references": {"type": "array", "maxItems": 8, "items": {"type": "string", "maxLength": 128}}, "omitted_item_references": {"type": "array", "maxItems": 32, "items": {"type": "string", "maxLength": 128}}, "rejected_item_references": {"type": "array", "maxItems": 32, "items": {"type": "string", "maxLength": 128}}, "classification": {"enum": ["public", "internal"]}, "trust_result": {"const": "approved_fixture"}, "freshness_result": {"const": "all_current"}, "revocation_result": {"const": "none"}, "conflict_count": {"type": "integer", "minimum": 0, "maximum": 16}, "uncertainty_count": {"type": "integer", "minimum": 1, "maximum": 16}, "limitations_count": {"type": "integer", "minimum": 1, "maximum": 16}, "package_set_digest": {"type": "string", "pattern": "^[0-9a-f]{64}$"}, "selection_digest": {"type": "string", "pattern": "^[0-9a-f]{64}$"}, "context_content_digest": {"type": "string", "pattern": "^[0-9a-f]{64}$"}, "budget_limits": {"type": "object", "additionalProperties": false, "required": ["maximum_context_bytes", "maximum_items", "maximum_evidence_references"], "properties": {"maximum_context_bytes": {"type": "integer", "minimum": 1}, "maximum_items": {"type": "integer", "maximum": 8}, "maximum_evidence_references": {"type": "integer", "maximum": 32}}}, "budget_consumption": {"type": "object", "additionalProperties": false, "required": ["maximum_context_bytes", "context_bytes", "selected_items", "evidence_references"], "properties": {"maximum_context_bytes": {"type": "integer", "minimum": 1, "maximum": 65536}, "context_bytes": {"type": "integer", "minimum": 1}, "selected_items": {"type": "integer", "minimum": 1, "maximum": 8}, "evidence_references": {"type": "integer", "minimum": 0, "maximum": 32}}}, "constructed_at": {"type": "string", "pattern": "^[0-9]{4}-[0-9]{2}-[0-9]{2}T[0-9]{2}:[0-9]{2}:[0-9]{2}Z$"}, "expires_at": {"type": "string", "pattern": "^[0-9]{4}-[0-9]{2}-[0-9]{2}T[0-9]{2}:[0-9]{2}:[0-9]{2}Z$"}, "lifecycle": {"const": "validated"}, "status": {"const": "success"}, "warnings": {"type": "array", "maxItems": 16, "items": {"type": "string", "maxLength": 256}}, "limitations": {"type": "array", "minItems": 1, "maxItems": 16, "items": {"type": "string", "maxLength": 512}}, "integrity": {"type": "object", "additionalProperties": false, "required": ["complete_report_sha256"], "properties": {"complete_report_sha256": {"type": "string", "pattern": "^[0-9a-f]{64}$"}}}
  }
}
